,gardid,disease,pmid,pubTypes,title,url,abstract
168,GARD:0002092,Ehrlichiosis,19819631,['Journal Article'],Natural history of Ehrlichia chaffeensis: vertebrate hosts and tick vectors from the United States and evidence for endemic transmission in other countries.,https://pubmed.ncbi.nlm.nih.gov/19819631,"Ehrlichia chaffeensis, an intracellular gram-negative zoonotic bacterium, is the causative agent of human monocytotropic ehrlichiosis (HME). In humans, the disease can range from a mild, non-specific illness with few to no clinical signs to a moderately severe to fatal disease, especially those with compromised immune systems. E. chaffeensis is maintained in a complex cycle involving white-tailed deer (WTD; Odocoileus virginianus) as a primary reservoir and the lone star tick (LST; Amblyomma americanum) as a primary vector. Numerous other species are naturally exposed to E. chaffeensis and disease has been documented in some domestic animals and wildlife including domestic dogs and ring-tailed lemurs. The organism has been found throughout the natural range of the LST and as the tick continues to expand its range, the geographic range of risk for E. chaffeensis infections will likely continue to expand. Recent data have indicated that E. chaffeensis, or a closely related organism, has been found in many species of ticks and vertebrate hosts in numerous countries."
169,GARD:0002092,Ehrlichiosis,19811878,['Journal Article'],The natural history of Anaplasma phagocytophilum.,https://pubmed.ncbi.nlm.nih.gov/19811878,"Anaplasma phagocytophilum is the recently designated name replacing three species of granulocytic bacteria, Ehrlichia phagocytophila, Ehrlichia equi and the agent of human granulocytic ehrlichiosis, after the recent reorganization of the families Rickettsiaceae and Anaplasmataceae in the order Rickettsiales. Tick-borne fever (TBF), which is caused by the prototype of A. phagocytophilum, was first described in 1932 in Scotland. A similar disease caused by a related granulocytic agent was first described in horses in the USA in 1969; this was followed by the description of two distinct granulocytic agents causing similar diseases in dogs in the USA in 1971 and 1982. Until the discovery of human granulocytic anaplasmosis (HGA) in the USA in 1994, these organisms were thought to be distinct species of bacteria infecting specific domestic animals and free-living reservoirs. It is now widely accepted that the agents affecting different animal hosts are variants of the same Gram-negative obligatory intracellular bacterium, which is transmitted by hard ticks belonging to the Ixodes persulcatus complex. One of its fascinating features is that it infects and actively grows in neutrophils by employing an array of mechanisms to subvert their bactericidal activity. It is also able to survive within an apparently immune host by employing a complex mechanism of antigenic variation. Ruminants with TBF and humans with HGA develop severe febrile reaction, bacteraemia and leukopenia due to neutropenia, lymphocytopenia and thrombocytopenia within a week of exposure to a tick bite. Because of the severe haematological disorders lasting for several days and other adverse effects on the host's immune functions, infected animals and humans are more susceptible to other infections."
170,GARD:0002096,Acrocephalopolydactyly,31891671,['Journal Article'],Albumin-bilirubin score is associated with response to pegylated interferon and nucleos(t)ide analogues in chronic hepatitis B patients.,https://pubmed.ncbi.nlm.nih.gov/31891671,"BACKGROUND AND AIM:Recently, the role of albumin-bilirubin (ALBI) score in chronic hepatitis B (CHB) has not been well-understood. We aimed to investigate the association of ALBI score with natural history of chronic HBV infection and treatment response of CHB patients. METHODS:The ALBI score in a cohort of 849 individuals including 721 chronic HBV-infected patients naïve to anti-HBV treatment in different phases and 128 healthy controls were estimated. Additionally, the dynamic changes of ALBI score of 243 hepatitis B e antigen (HBeAg)-positive CHB patients treated with pegylated interferon-alpha (PEG-IFN-α) or nucleos(t)ide analogues (NAs) were tested for 72 weeks. RESULTS:ALBI score differed among phases, with the highest score in HBeAg-positive CHB patients, followed by HBeAg-negative CHB patients, HBeAg-positive chronic HBV infection, and HBeAg-negative chronic HBV infection. Besides, CHB patients harbouring high baseline ALBI score exhibited a relatively stronger therapeutic response to PEG-IFN-α or NAs. Moreover, the rate of HBeAg and HBsAg loss in patients with ALBI grade 2 was persistently higher than that in patients with ALBI grade 1 throughout the course of treatment. Furthermore, ALBI score was an independent predictor of sustained response achievement. The combined use of ALBI score, HBeAg and ALT could enhance the predictive value of treatment response. CONCLUSIONS:ALBI score differed significantly across the natural course of chronic HBV infection and was correlated with PEG-IFN-α and NAs treatment response in HBeAg-positive CHB patients, which suggested that ALBI score could be useful as an auxiliary clinical factor to determine the initiation of therapy and predict stronger antiviral treatment response."
171,GARD:0002096,Acrocephalopolydactyly,31891629,"[""Research Support, Non-U.S. Gov't"", 'research-article', 'Journal Article']",Rapid evolution of prey maintains predator diversity.,https://pubmed.ncbi.nlm.nih.gov/31891629,"Factors maintaining the populations of diverse species that share limited resources or prey remain important issues in ecology. In the present study, I propose that heritable intraspecific variation in prey, which facilitates natural selection, is a key to solve this issue. A mathematical model reveals that diverse genotypes in a prey promote the coexistence of multiple predator species. When two predators share a prey with multiple genotypes, evolution nearly selects the two prey genotypes. Through analysis, I establish a condition of coexistence of such multiple predator-one prey interaction with two genotypes. If each prey type has high defensive capacity against different predator species, stable coexistence is likely to occur. Particularly, interspecific variations of life-history parameters allow the coexistence equilibrium to be stable. In addition, rapid evolution in a prey allows more than two predator species to coexist. Furthermore, mutation tends to stabilize otherwise unstable systems. These results suggest that intraspecific variation in a prey plays a key role in the maintenance of diverse predator species by driving adaptive evolution."
172,GARD:0002096,Acrocephalopolydactyly,31891589,"[""Research Support, Non-U.S. Gov't"", 'research-article', 'Journal Article']",Predictive sampling effort and species-area relationship models for estimating richness in fragmented landscapes.,https://pubmed.ncbi.nlm.nih.gov/31891589,"Loss of habitat, specifically deforestation, is a major driver of biodiversity loss. Species-area relationship (SAR) models traditionally have been used for estimating species richness, species loss as a function of habitat loss, and extrapolation of richness for given areas. Sampling-species relationships (SSRs) are interrelated yet separate drivers for species richness estimates. Traditionally, however, SAR and SSR models have been used independently and not incorporated into a single approach. We developed and compared predictive models that incorporate sampling effort species-area relationships (SESARS) along the entire Atlantic Forest of South America, and then applied the best-fit model to estimate richness in forest remnants of Interior Atlantic Forest of eastern Paraguay. This framework was applied to non-volant small mammal assemblages that reflect different tolerances to forest loss and fragmentation. In order to account for differences in functionality we estimated small mammal richness of 1) the entire non-volant small mammal assemblage, including introduced species; 2) the native species forest assemblage; and 3) the forest-specialist assemblage, with the latter two assemblages being subsets of the entire assemblage. Finally, we geospatially modeled species richness for each of the three assemblages throughout eastern Paraguay to identify remnants with high species richness. We found that multiple regression power-law interaction-term models that only included area and the interactions of area and sampling as predictors, worked best for predicting species richness for the entire assemblage and the native species forest assemblage, while several traditional SAR models (logistic, power, exponential, and ratio) best described forest-specialist richness. Species richness was significantly different between assemblages. We identified obvious remnants with high species richness in eastern Paraguay, and these remnants often were geographically isolated. We also found relatively high predicted species richness (in relation to the entire range of predicted richness values) in several geographically-isolated, medium-size forest remnants that likely have not been considered as possible priority areas for conservation. These findings highlight the importance of using an empirical dataset, created using sources representing diverse sampling efforts, to develop robust predictive models. This approach is particularly important in geographic locations where field sampling is limited yet the geographic area is experiencing rapid and dramatic land cover changes. When combined, area and sampling are powerful modeling predictors for questions of biogeography, ecology, and conservation, especially when addressing habitat loss and fragmentation."
173,GARD:0002096,Acrocephalopolydactyly,31891586,"[""Research Support, Non-U.S. Gov't"", 'research-article', ""Research Support, U.S. Gov't, Non-P.H.S."", 'Journal Article']",A framework for the development of a global standardised marine taxon reference image database (SMarTaR-ID) to support image-based analyses.,https://pubmed.ncbi.nlm.nih.gov/31891586,"Video and image data are regularly used in the field of benthic ecology to document biodiversity. However, their use is subject to a number of challenges, principally the identification of taxa within the images without associated physical specimens. The challenge of applying traditional taxonomic keys to the identification of fauna from images has led to the development of personal, group, or institution level reference image catalogues of operational taxonomic units (OTUs) or morphospecies. Lack of standardisation among these reference catalogues has led to problems with observer bias and the inability to combine datasets across studies. In addition, lack of a common reference standard is stifling efforts in the application of artificial intelligence to taxon identification. Using the North Atlantic deep sea as a case study, we propose a database structure to facilitate standardisation of morphospecies image catalogues between research groups and support future use in multiple front-end applications. We also propose a framework for coordination of international efforts to develop reference guides for the identification of marine species from images. The proposed structure maps to the Darwin Core standard to allow integration with existing databases. We suggest a management framework where high-level taxonomic groups are curated by a regional team, consisting of both end users and taxonomic experts. We identify a mechanism by which overall quality of data within a common reference guide could be raised over the next decade. Finally, we discuss the role of a common reference standard in advancing marine ecology and supporting sustainable use of this ecosystem."
174,GARD:0002096,Acrocephalopolydactyly,31891549,['Journal Article'],"Genotyping-by-Sequencing for Analysis of the Genetic Variation of Podosphaera xanthii, Incitant of Cucurbit Powdery Mildew.",https://pubmed.ncbi.nlm.nih.gov/31891549,"This research was conducted to identify species causing powdery mildew on cucurbits and to determine genetic variations among isolates of the pathogen. We collected 109 isolates from six cucurbit species hosts (Cucumis melo, Cucumis sativus, Cucurbita maxima, Cucurbita moschata, Cucurbita pepo, and Lagenaria siceraria) in California, Illinois, Indiana, Michigan, New York, Texas, Washington, and Wisconsin in the United States and in Italy. By sequencing the internal transcribed spacer region of the nuclear rDNA of these 109 isolates, Podosphaera xanthii was found as the only species causing powdery mildew on cucurbits in the United States. Genotyping-by-sequencing was applied to these 109 isolates to investigate their genetic diversity, which showed a trend of isolates clustering from New York and Italy. In addition, the virulence of 36 isolates was compared and a significant difference (P < 0.0001) was found among them. Furthermore, results of the virulence tests of 28 isolates from Illinois showed significant effects of collection years, hosts, and locations on the virulence of the isolates."
175,GARD:0002098,Ellis Yale Winter syndrome,N/A,N/A,,N/A,N/A
176,GARD:0002099,Emerinopathy,N/A,N/A,,N/A,N/A
177,GARD:0002104,Congenital lobar emphysema,27232731,['Journal Article'],Outcome of infants operated on for congenital pulmonary malformations.,https://pubmed.ncbi.nlm.nih.gov/27232731,"Patients operated on for congenital pulmonary malformations (CPM) have excellent survival rates, but little is known about long-term morbidity. Our aim is to report the sequelae in patients operated on for CPM in infancy and to define factors that may influence their outcome.All patients operated on for major congenital anomalies are followed in a dedicated outpatient program and evaluated at 6, 24, and 48 months of life (corrected for gestational age) and at school age at 4, 6, 8, and 12 years of life. The data are prospectively collected. Patients operated on for CPM and enrolled in the follow-up clinic between January 2004 and December 2010 are compared with a control group of term infants operated on for inguinal hernia, without other major congenital or acquired abnormalities. The two groups were compared for auxological, respiratory, and orthopedic outcome.In the study period, 76 consecutive patients with CPM attended our dedicated follow-up clinic. Eight non-operated patients were excluded from the study. Age at follow-up was 82.0 (56.1-103.7) months in CPM patients and 83.5 (75.2-90.4) months in controls (P = 0.79). Fifty-three patients with CPM (78%) had one or more clinical or radiological abnormality versus six (16%) control patients (OR [95%CI] 16.5 [5.8-47.2]; P < 0.0001).Over 50% of patients with CPM present long-term sequelae, regardless type of malformation. Therefore, long-term follow-up of patients operated on for CPM is recommended. Further studies are needed to define if, in asymptomatic patients, surgery may modify the natural history of CPM. Pediatr Pulmonol. 2016;51:1367-1372. © 2016 Wiley Periodicals, Inc."
178,GARD:0002104,Congenital lobar emphysema,25448785,"['Review', 'Journal Article']",Congenital cystic lesions of the lung.,https://pubmed.ncbi.nlm.nih.gov/25448785,"Congenital cystic lesions of the lung are present in 1 in 10,000-35,000 births and present as a spectrum of anomalies. Majority of these cystic lesions comprise congenital cystic adenomatoid malformations, pulmonary sequestrations, congenital lobar emphysema, and bronchogenic cysts. Most of these lesions are nowadays detected antenatally, however some will present either in the newborn or during later childhood. A review of the aetiology, classification, natural history, investigations, and treatment of congenital cystic lung lesions is discussed."
179,GARD:0002104,Congenital lobar emphysema,24701729,['Journal Article'],Surgical outcomes for congenital lung malformations: 10 years experience at a single center.,https://pubmed.ncbi.nlm.nih.gov/24701729,"OBJECTIVE: To study the surgical outcome of congenital lung malformation and natural history of the disease at Srinagarind Hospital. MATERIAL AND METHOD: Retrospectively review the medical records of 25 patients diagnosed with congenital lung malformation who underwent surgical treatment between January 2001 and December 2011. RESULTS: Twenty-five patients diagnosed with congenital lung malformation underwent surgery: 16 males (64%), 9 females (36%), median age seven months, median body weight 6 kg. Twelve (48%) had congenital cystic adenomatoid malformation congenital cystic adenomatoidmaflormation (CCAM), seven (28%) pulmonary sequestration, four (16%) congenital lobar emphysema, and one a bronchogenic cyst (4%). The most common presenting symptoms were respiratory tract infection (14, 56%), respiratory distress (7, 28%), lung abscess (1, 4%), hemoptysis (1, 40%), and asymptomatic (2, 8%). Post-operative mortality over 30 days was 0. Complications included lung infection, atelectasis, post-operative bleeding, and wound infection. Post-operative follow-up (lasting between 1-8 years) revealed normal tolerance to daily activity without any respiratory problems. CONCLUSION: Surgical treatment for congenital lung malformations had a good result with few complications."
180,GARD:0002104,Congenital lobar emphysema,24406806,['Journal Article'],Conservative management of antenatally diagnosed cystic lung malformations.,https://pubmed.ncbi.nlm.nih.gov/24406806,"AIM: To review the outcome of all antenatally diagnosed conservatively managed congenital lung malformations (CLMs) managed at our centre. METHODS: All patients diagnosed antenatally with cystic lung malformations from 2001 to 2011, at a tertiary referral paediatric surgical centre practising a policy of conservative management of asymptomatic cases, were retrospectively reviewed. Data were collected from medical case notes and radiology reports. Ethical approval was obtained from our institutional research and development department. RESULTS: The complete records of 74 fetuses antenatally diagnosed with CLM were reviewed. There were 72 live births, at a median gestation of 39.6 weeks. Emergency lobectomy was performed in one symptomatic neonate. Elective lobectomies were performed at parental request in three asymptomatic infants, one of whom had a family history of synovial sarcoma. Two patients developed pneumonia in the affected lobe during early childhood and proceeded to lobectomy at the age of 3 years. One patient with a bronchopulmonary sequestration required embolisation for cyanotic episodes. The remaining 65 patients have been conservatively managed to date, and none have required hospital admission. Less than a quarter report mild respiratory symptoms such as cough or wheeze. Median follow-up is 5 years. CONCLUSIONS: This retrospective cohort study of 74 consecutive CLMs diagnosed antenatally over a 10-year period demonstrates that most of these lesions will remain asymptomatic throughout childhood. Although the natural history of CLMs in later years remains to be elucidated, we hope that this report on medium-term outcomes will be useful to clinicians who undertake antenatal counselling and may inform the discussion on how best to manage these children."
181,GARD:0002104,Congenital lobar emphysema,22542416,"['Review', 'Journal Article', 'English Abstract']",[Congenital lung malformations: natural history and pathophysiological mechanisms].,https://pubmed.ncbi.nlm.nih.gov/22542416,"INTRODUCTION: Congenital lung lesions comprise a broad spectrum of various malformations including congenital cystic adenomatoid malformation (CCAM), bronchopulmonary sequestration (BPS), congenital lobar emphysema, bronchial atresia and bronchogenic cyst. This review aims at the description of their natural history, and of the underlying pathophysiological mechanisms. STATE OF THE ART: Congenital lung lesions are frequently diagnosed antenatally and many remain asymptomatic after birth. In the absence of antenatal identification, they are usually revealed by the occurrence of infection. In some cases, spontaneous resolution of the malformation can occur. Different pathogenic hypotheses are discussed for the origin of these abnormalities, and common processes appear likely to all of these malformations. Factors involved in the process of branching seem to play a particularly important role. PERSPECTIVES: Prospective follow-up of operated and unoperated children would complete our knowledge about the natural history of these lesions. The contribution of experimental models has led to advances in the understanding of pathogenic mechanisms. Further studies are needed to identify the factors initiating the malformative process."
182,GARD:0002106,Enamel hypoplasia cataract hydrocephaly,N/A,N/A,,N/A,N/A
183,GARD:0002108,Encephalocraniocutaneous lipomatosis,19574261,"['Review', 'Journal Article']",Encephalocraniocutaneous lipomatosis.,https://pubmed.ncbi.nlm.nih.gov/19574261,"BACKGROUND: Encephalocraniocutaneous lipomatosis (ECCL) is a sporadically occurring neurocutaneous disorder of unknown aetiology. It has repeatedly been discussed as a localised form of Proteus syndrome. In 2006, the first large series of patients was reported, and diagnostic criteria were proposed. AIMS: To better define the phenotypic spectrum and natural history of ECCL and to revise diagnostic criteria. METHODS: 54 patients with ECCL were reviewed. RESULTS: Eye anomalies (mainly choristomas) and skin lesions (non-scarring alopecia, naevus psiloliparus, subcutaneous fatty masses, nodular skin tags, aplastic scalp defects) may be unilateral or bilateral and occur in a consistent pattern. Central nervous system anomalies consist of intracranial and intraspinal lipomas, congenital abnormalities of the meninges, and putative focal vascular defects resulting in highly asymmetrical changes. About two-thirds of patients have a normal development or mild retardation only, and half of them have seizures. No correlation between the extent of central nervous system anomalies and neurological features could be established. Aortic coarctation, progressive bone cysts and jaw tumours may be associated. CONCLUSIONS: Revised diagnostic criteria are proposed. ECCL is considered to differ from Proteus syndrome in particular, but oculoectodermal syndrome is possibly a mild variant. Pathogenetically, mosaicism for a mutated autosomal gene involved in multiple mesenchymal tumours and vasculogenesis, with or without a second hit event, is discussed."
184,GARD:0002108,Encephalocraniocutaneous lipomatosis,8985729,"['Journal Article', 'Case Reports']","Oculocerebrocutaneous syndrome: a case report, a follow-up, and differential diagnostic considerations.",https://pubmed.ncbi.nlm.nih.gov/8985729,"Oculocerebrocutaneous syndrome consists essentially of orbital cysts and microphthalmia/anophthalmia, focal dermal defects, skin appendages and malformations of the central nervous system. Up to now, about 20 sporadic cases have been reported. Limited information is available on the clinical spectrum and on the natural history. We present the long-term follow-up of a 19 year-old patient who was one of the first two patients described by Delleman and Oorthuys in 1981. Furthermore, we report on a new case presenting with bilateral anophthalmia and orbital cysts, typical skin lesions, a complex brain malformation and cleft lip palate. This infant died due to the severe cerebral malformations at the age of 10 months. Encephalocraniocutaneous lipomatosis, focal dermal hypoplasia and microphthalmia with linear skin defects (MLS) syndrome are discussed as the most important differential diagnostic entities."
185,GARD:0002108,Encephalocraniocutaneous lipomatosis,3152479,"['Journal Article', 'Case Reports']","Understanding Proteus syndrome, unmasking the elephant man, and stemming elephant fever.",https://pubmed.ncbi.nlm.nih.gov/3152479,"Four patients with Proteus syndrome are reported; 3 of the 4 died of unusual causes. Current findings of the syndrome are reviewed, and the present state of its delineation is assessed with emphasis on what is known about natural history. Differential diagnosis includes neurofibromatosis, Klippel-Trénaunay-Weber syndrome, Maffucci syndrome, epidermal nevus syndrome, and the combination of Bannayan-Zonana syndrome, Riley-Smith syndrome, and Ruvalcaba-Myhre syndrome, now thought to constitute a single disorder. Conditions that may possibly overlap with Proteus syndrome--encephalocraniocutaneous lipomatosis and Thanos syndrome--receive special attention. Various suggested diagnoses for the elephant man's disorder are evaluated, and it is concluded that he suffered from Proteus syndrome, not neurofibromatosis. Finally, the psychosocial significance of elephant fever (EF) is discussed, and a plea is made for taking the EF out of NF."
