,gardid,disease,pmid,pubTypes,title,url,abstract
0,GARD:0001883,Dissecting cellulitis of the scalp,24284093,"['Review', 'Journal Article', 'Case Reports']",Successful treatment of recalcitrant dissecting cellulitis of the scalp with ALA-PDT: case report and literature review.,https://pubmed.ncbi.nlm.nih.gov/24284093,"A case of refractory dissecting cellulitis of the scalp (DCS) in a forty-one-year-old Chinese female patient was treated with a total of 6 sessions of topical ALA-PDT at one week intervals. The patient tolerated and responded well to this new approach without any adverse events. This suggested that topical ALA-PDT could be an effective and safe alternative for DCS patients who were refractory to other conventional therapies. We also reviewed etiology, pathophysiology, natural history and treatment options for DCS."
1,GARD:0001883,Dissecting cellulitis of the scalp,19554179,"['Case Reports', 'case-report']",Management of fulminant dissecting cellulitis of the scalp in the pediatric population: Case report and literature review.,https://pubmed.ncbi.nlm.nih.gov/19554179,"A case of fulminant dissecting cellulitis of the scalp in a fifteen-year-old African American male is reported. The presentation was refractory to standard medical treatment such that treatment required radical subgaleal excision of the entire hair-bearing scalp. Reconstruction was in the form of split-thickness skin grafting at the level of the pericranium following several days of vacuum-assisted closure dressing to promote an acceptable wound bed for skin grafting and to ensure appropriate clearance of infection. Numerous nonsurgical modalities have been described for the treatment of dissecting cellulitis of the scalp, with surgical intervention reserved for patients refractory to medical treatment. The present paper reports a fulminant form of the disease in an atypical age of presentation, adolescence. The pathophysiology, etiology, natural history, complications and treatment options for dissecting cellulitis of the scalp are reviewed, and the authors suggest this method of treatment to be efficacious for severe presentations refractory to medical therapy."
2,GARD:0001886,"Late-onset distal myopathy, Markesbery-Griggs type",N/A,N/A,,N/A,N/A
3,GARD:0001887,Distal myopathy with vocal cord weakness,N/A,N/A,,N/A,N/A
4,GARD:0001889,"Distal primary acidosis, familial",N/A,N/A,,N/A,N/A
5,GARD:0001890,Distichiasis heart congenital anomalies,20447153,"[""Research Support, Non-U.S. Gov't"", 'Journal Article']",A new classification system for primary lymphatic dysplasias based on phenotype.,https://pubmed.ncbi.nlm.nih.gov/20447153,"Traditional classification systems for lymphoedema are of limited use for the diagnosis of specific forms of primary lymphoedema. The understanding of primary lymphoedema has been impeded by confusing terminology and a tendency to simply divide patients into three categories based on the age of onset: lymphoedema congenita manifests at or shortly after birth, lymphoedema praecox is apparent before the age of 35 years and lymphoedema tarda manifests thereafter. The clinical presentation in the spectrum of primary lymphoedema disorders is very variable; the phenotypes of primary lymphoedema conditions vary in the age of onset, site of the oedema, inheritance patterns, associated features and genetic causes. Different inheritance patterns are recognised and there are numerous associated anomalies. Some subgroups, such as Milroy disease and Lymphoedema distichiasis, are well characterised, but others are not. A new clinical classification for primary lymphoedema has been developed as a diagnostic algorithm. Its use is demonstrated on 333 probands referred to our lymphoedema clinic. Grouping patients by accurate phenotyping facilitates molecular investigations, understanding of inheritance patterns, and the natural history of different types of primary lymphoedema. Descriptions of the diagnostic categories, some of which have not been previously clearly defined as distinct clinical entities, are illustrated by clinical cases."
6,GARD:0001891,Distomatosis,31863765,"[""Research Support, Non-U.S. Gov't"", 'Journal Article']","Genetic structure and geographical variation of Bithynia siamensis goniomphalos sensu lato (Gastropoda: Bithyniidae), the snail intermediate host of Opisthorchis viverrini sensu lato (Digenea: Opisthorchiidae) in the Lower Mekong Basin revealed by mitochondrial DNA sequences.",https://pubmed.ncbi.nlm.nih.gov/31863765,"The freshwater snail Bithynia siamensis goniomphalos sensu lato is widely distributed in the Lower Mekong Basin where it acts as the first intermediate host of the liver fluke Opisthorchis viverrini, a group 1 carcinogen causing cholangiocarcinoma. This study explores the genetic structure and geographical variation of B. s. goniomphalos from eight previously studied catchments and eight new catchments. These catchments belong to five previously studied catchment systems and one new catchment system (Tonlesap) in the Lower Mekong Basin. Two new catchment systems, Prachin Buri and Bang Pakong from eastern and central Thailand, respectively, were also examined. We collected 289 specimens of B. s. goniomphalos from 15 previously studied localities and 18 new localities in Thailand, Lao PDR (People's Democratic Republic), and Cambodia. The mitochondrial cytochrome c oxidase subunit 1 and 16S ribosomal DNA sequences were used to determine genetic variation. Classification of haplotypes specified 100 at the cox1 locus and 15 at the rrnL locus. Comparison between 16 catchment populations found significant genetic differences (ФST) between all populations. The phylogenetic tree and haplotype network analyses classified B. s. goniomphalos into three evolutionary lineages (lineage I-III). Lineage I contained B. s. goniomphalos from the Mekong, Chi, Mun, Prachin Buri and Bang Pakong catchments in Thailand, including the Nam Ngum catchment in Lao PDR. Lineage II contained all specimens from the Tonlesap catchment, whereas lineage III contained specimens from the Mekong and Sea Bang Heang catchments in Thailand and Lao PDR, respectively. Interestingly, Bithynia siamensis siamensis was placed between lineages I and II of B. s. goniomphalos. This study supports the hypothesis that B. s. goniomphalos is a species complex containing at least three distinct evolutionary lineages in the Lower Mekong Basin, and that comprehensive molecular genetic analyses need to be conducted to further our understanding of the evolutionary and systematic relationships of these Bithynia snail taxa."
7,GARD:0001891,Distomatosis,31782012,['Journal Article'],Are glial cells of the Digenea (Platyhelminthes) muscle cells?,https://pubmed.ncbi.nlm.nih.gov/31782012,"Muscle cells of a digenean fish blood fluke, Aporocotyle simplex, aggregate along the periphery of the cerebral ganglia. Solitary myocytons and sarcoplasmic processes with muscle fibres give rise to long, narrow lamellate projections, which are visible along the periphery and within ganglia. These ultrastructural observations suggest a switching of glial functions to muscle cells and represent additional evidence of the phylogenetic lability of glial cells in bilaterians."
8,GARD:0001891,Distomatosis,31734338,"[""Research Support, Non-U.S. Gov't"", 'Journal Article']",No barrier breakdown between human and cattle schistosome species in the Senegal River Basin in the face of hybridisation.,https://pubmed.ncbi.nlm.nih.gov/31734338,"Schistosomiasis is widely distributed along the Senegal River Basin (SRB), affecting both the human population and their livestock. Damming of the Senegal River for irrigation purposes in the 1980s induced ecological changes that resulted in a large outbreak of Schistosoma mansoni, followed a few years later by an increase and spread of Schistosoma haematobium infections. The presence of hybrid crosses between the human and cattle schistosomes, S. haematobium and Schistosoma bovis, respectively, is adding complexity to the disease epidemiology in this area, and questions the strength of the species boundary between these two species. This study aimed to investigate the epidemiology of S. haematobium, S. bovis and their hybrids along the Senegal River basin using both microsatellite genetic markers and analysis of mitochondrial and nuclear DNA markers. Human schistosome populations with a S. haematobium cox1 mtDNA profile and those with a S. bovis cox1 mtDNA profile (the so-called hybrids) appear to belong to a single randomly mating population, strongly differentiated from the pure S. bovis found in cattle. These results suggest that, in northern Senegal, a strong species boundary persists between human and cattle schistosome species and there is no prolific admixing of the populations. In addition, we found that in the SRB S. haematobium was spatially more differentiated in comparison to S. mansoni. This may be related either to the presence and susceptibility of the intermediate snail hosts, or to the colonisation history of the parasite."
9,GARD:0001891,Distomatosis,31714254,['Journal Article'],"Alpine bullhead (Cottus poecilopus Heckel): a potential refuge for Gyrodactylus salaris Malmberg, 1957 (Monogenea).",https://pubmed.ncbi.nlm.nih.gov/31714254,"The notifiable freshwater pathogen Gyrodactylus salaris Malmberg, 1957 tends to be a generalist in contrast to other monogeneans. Whilst it causes most damage to its primary host, the Atlantic salmon (Salmo salar Linnaeus), transport and reservoir hosts likely play a key role in maintaining the parasite in the environment. Here, we tested the ability of G. salaris (strain River Lierelva, southern Norway) to infect and reproduce on a population of wild caught alpine bullhead (Cottus poecilopus Heckel). Exposure of alpine bullhead yearlings (0+) to G. salaris for 24 h at low (6.5 °C) or high temperature (11.5 °C) resulted in the establishment of 1 to 104 parasites per fish. Eight to nine days post-infection at high temperature, the infection of G. salaris was eliminated, indicative of innate host immunity. In contrast, at low temperature G. salaris infections persisted for 47-48 days. The relative lengthy infection of alpine bullhead with G. salaris compared to other non-salmonids tested may be due to low temperature and high initial infection load in combination with an epibiont infection. The present results suggest that this non-salmonid may function as a temperature-dependent transport or reservoir host for G. salaris."
10,GARD:0001891,Distomatosis,31701859,['Journal Article'],Infection Dynamics of Opisthorchis viverrini Metacercariae in Cyprinid Fishes from Two Endemic Areas in Thailand and Lao PDR.,https://pubmed.ncbi.nlm.nih.gov/31701859,"The infection dynamics of Opisthorchis viverrini metacercariae was analyzed in cyprinid fish from endemic areas in Mukdahan Province, Thailand, and Khammouane Province, Lao PDR. The fish were collected during the cool-dry (November-February), hot-dry (March-May), and rainy (June-October) seasons in 2017. They were examined by the digestion method, and the infection status was statistically analyzed by study area, season, and fish size. The prevalence (no. of fish positive/no. of fish examined × 100) and metacercarial intensities (no. of metacercariae detected/no. of fish positive) of O. viverrini in both study areas depended on season, being high in the cool-dry season and varying in the hot-dry and rainy seasons. In Mukdahan Province, the average prevalence was 18.3% (range 11.0-46.7%, n = 420) and the intensity was 4.07 ± 5.86 cysts/fish (mean ± SD), whereas in Khammouane Province, the prevalence was 51.9% (range 9.1-70.6%, n = 673) and the intensity was 6.67 ± 12.88 cysts/fish. Among the cyprinid fish species examined, the infection was associated with fish body size and predominantly found in Hampala dispar (86.5%), Cyclocheilichthys armatus (73.2%), and Puntius brevis (42.7%). The distribution of O. viverrini metacercariae in fish was skewed, with most of the fish having a low worm burden with an average of four to six cysts/fish. The findings that seasonality, sampling locality, fish size, and species of fish play roles in the risk of O. viverrini infection imply that these host and environmental factors are important for the transmission dynamics and control of O. viverrini."
11,GARD:0001894,DK phocomelia syndrome,N/A,N/A,,N/A,N/A
12,GARD:0001895,Dobrow syndrome,N/A,N/A,,N/A,N/A
13,GARD:0001896,Dominant cleft palate,29436146,"[""Research Support, Non-U.S. Gov't"", 'Journal Article']",Natural history and genotype-phenotype correlations in 72 individuals with SATB2-associated syndrome.,https://pubmed.ncbi.nlm.nih.gov/29436146,"SATB2-associated syndrome (SAS) is an autosomal dominant disorder characterized by significant neurodevelopmental disabilities with limited to absent speech, behavioral issues, and craniofacial anomalies. Previous studies have largely been restricted to case reports and small series without in-depth phenotypic characterization or genotype-phenotype correlations. Seventy two study participants were identified as part of the SAS clinical registry. Individuals with a molecularly confirmed diagnosis of SAS were referred after clinical diagnostic testing. In this series we present the most comprehensive phenotypic and genotypic characterization of SAS to date, including prevalence of each clinical feature, neurodevelopmental milestones, and when available, patient management. We confirm that the most distinctive features are neurodevelopmental delay with invariably severely limited speech, abnormalities of the palate (cleft or high-arched), dental anomalies (crowding, macrodontia, abnormal shape), and behavioral issues with or without bone or brain anomalies. This comprehensive clinical characterization will help clinicians with the diagnosis, counseling and management of SAS and help provide families with anticipatory guidance."
14,GARD:0001896,Dominant cleft palate,24587008,"[""Research Support, Non-U.S. Gov't"", 'research-article', 'Journal Article']",Absence of cardiovascular manifestations in a haploinsufficient Tgfbr1 mouse model.,https://pubmed.ncbi.nlm.nih.gov/24587008,"Loeys-Dietz syndrome (LDS) is an autosomal dominant arterial aneurysm disease belonging to the spectrum of transforming growth factor β (TGFβ)-associated vasculopathies. In its most typical form it is characterized by the presence of hypertelorism, bifid uvula/cleft palate and aortic aneurysm and/or arterial tortuosity. LDS is caused by heterozygous loss of function mutations in the genes encoding TGFβ receptor 1 and 2 (TGFBR1 and -2), which lead to a paradoxical increase in TGFβ signaling. To address this apparent paradox and to gain more insight into the pathophysiology of aneurysmal disease, we characterized a new Tgfbr1 mouse model carrying a p.Y378* nonsense mutation. Study of the natural history in this model showed that homozygous mutant mice die during embryonic development due to defective vascularization. Heterozygous mutant mice aged 6 and 12 months were morphologically and (immuno)histochemically indistinguishable from wild-type mice. We show that the mutant allele is degraded by nonsense mediated mRNA decay, expected to result in haploinsufficiency of the mutant allele. Since this haploinsufficiency model does not result in cardiovascular malformations, it does not allow further study of the process of aneurysm formation. In addition to providing a comprehensive method for cardiovascular phenotyping in mice, the results of this study confirm that haploinsuffciency is not the underlying genetic mechanism in human LDS."
15,GARD:0001896,Dominant cleft palate,24443023,"['Review', 'Journal Article']",Loeys-Dietz syndrome.,https://pubmed.ncbi.nlm.nih.gov/24443023,"Loeys-Dietz syndrome is an autosomal dominant aortic aneurysm syndrome characterized by multisystemic involvement. The most typical clinical triad includes hypertelorism, bifid uvula or cleft palate and aortic aneurysm with tortuosity. Natural history is significant for aortic dissection at smaller aortic diameter and arterial aneurysms throughout the arterial tree. The genetic cause is heterogeneous and includes mutations in genes encoding for components of the transforming growth factor beta (TGFβ) signalling pathway: TGFBR1, TGFBR2, SMAD3 and TGFB2. Despite the loss of function nature of these mutations, the patient-derived aortic tissues show evidence of increased (rather than decreased) TGFβ signalling. These insights offer new options for therapeutic interventions."
16,GARD:0001896,Dominant cleft palate,20131279,"[""Research Support, Non-U.S. Gov't"", 'Journal Article', 'Case Reports']",Premature arthritis is a distinct type II collagen phenotype.,https://pubmed.ncbi.nlm.nih.gov/20131279,"Mutations in the gene encoding type II collagen (COL2A1) give rise to a spectrum of phenotypes predominantly affecting cartilage and bone. These chondrodysplasias are typically characterized by disproportionately short stature, eye abnormalities, cleft palate, and hearing loss. It is less recognized that mutations in COL2A1 can also present as degenerative joint disease in the absence of any other phenotypic clues. We report 2 Australian families presenting with an isolated arthritis phenotype, segregating as a dominant trait affecting both large and small joints, prior to age 30 years. Sequencing of COL2A1 in the propositi revealed 2 sequence changes resulting in glycine substitutions in the triple-helical domain of type II collagen. We review the increasing evidence implicating COL2A1 mutations in individuals presenting with isolated degenerative joint disease, aiming to alert physicians who assess these patients to this possibility. The importance of finding a COL2A1 mutation in such patients lies in the subsequent ability to accurately assess recurrence risks, offer early (including prenatal) diagnosis, and provide information regarding the natural history of the condition. Most importantly, it enables at-risk individuals to be identified for implementation of preventative strategies (i.e., weight loss, joint-friendly exercise programs) and early ameliorative management of their condition."
17,GARD:0001896,Dominant cleft palate,16928994,"[""Research Support, Non-U.S. Gov't"", 'Journal Article', 'Research Support, N.I.H., Extramural']",Aneurysm syndromes caused by mutations in the TGF-beta receptor.,https://pubmed.ncbi.nlm.nih.gov/16928994,"BACKGROUND: The Loeys-Dietz syndrome is a recently described autosomal dominant aortic-aneurysm syndrome with widespread systemic involvement. The disease is characterized by the triad of arterial tortuosity and aneurysms, hypertelorism, and bifid uvula or cleft palate and is caused by heterozygous mutations in the genes encoding transforming growth factor beta receptors 1 and 2 (TGFBR1 and TGFBR2, respectively). METHODS: We undertook the clinical and molecular characterization of 52 affected families. Forty probands presented with typical manifestations of the Loeys-Dietz syndrome. In view of the phenotypic overlap between this syndrome and vascular Ehlers-Danlos syndrome, we screened an additional cohort of 40 patients who had vascular Ehlers-Danlos syndrome without the characteristic type III collagen abnormalities or the craniofacial features of the Loeys-Dietz syndrome. RESULTS: We found a mutation in TGFBR1 or TGFBR2 in all probands with typical Loeys-Dietz syndrome (type I) and in 12 probands presenting with vascular Ehlers-Danlos syndrome (Loeys-Dietz syndrome type II). The natural history of both types was characterized by aggressive arterial aneurysms (mean age at death, 26.0 years) and a high incidence of pregnancy-related complications (in 6 of 12 women). Patients with Loeys-Dietz syndrome type I, as compared with those with type II, underwent cardiovascular surgery earlier (mean age, 16.9 years vs. 26.9 years) and died earlier (22.6 years vs. 31.8 years). There were 59 vascular surgeries in the cohort, with one death during the procedure. This low rate of intraoperative mortality distinguishes the Loeys-Dietz syndrome from vascular Ehlers-Danlos syndrome. CONCLUSIONS: Mutations in either TGFBR1 or TGFBR2 predispose patients to aggressive and widespread vascular disease. The severity of the clinical presentation is predictive of the outcome. Genotyping of patients presenting with symptoms like those of vascular Ehlers-Danlos syndrome may be used to guide therapy, including the use and timing of prophylactic vascular surgery."
18,GARD:0001898,Early-onset zonular cataract,N/A,N/A,,N/A,N/A
19,GARD:0001899,Donnai-Barrow syndrome,N/A,N/A,,N/A,N/A
20,GARD:0001902,Tyrosine hydroxylase deficiency,N/A,N/A,,N/A,N/A
21,GARD:0001903,Dopamine beta hydroxylase deficiency,N/A,N/A,,N/A,N/A
22,GARD:0001904,Subcortical band heterotopia,N/A,N/A,,N/A,N/A
23,GARD:0001905,Double discordia,N/A,N/A,,N/A,N/A
24,GARD:0001906,Double fingernail of fifth finger,N/A,N/A,,N/A,N/A
25,GARD:0001907,Double outlet left ventricle,21163892,"[""Research Support, Non-U.S. Gov't"", 'Journal Article']",Prenatal ultrasound screening of congenital heart disease in an unselected national population: a 21-year experience.,https://pubmed.ncbi.nlm.nih.gov/21163892,"OBJECTIVE: To determine the prevalence and spectrum of congenital heart disease (CHD) and the impact of a national prenatal ultrasound screening programme on outcome in a well-characterised population. DESIGN AND SETTING: A comprehensive registry was created of all paediatric and fetal patients with CHD over a 21-year period (1986-2006) in the Czech Republic. The centralised healthcare system enabled confirmation of prenatal and postnatal findings clinically and by post mortem. PATIENTS AND RESULTS: In the entire cohort of 9475 fetuses referred for detailed cardiac evaluation, 1604 (16.9%) had CHD, of which 501 (31.2%) had additional extracardiac anomalies. In the pregnancies which continued, 59 (8.6%) of 685 fetuses died in utero, and 626 (91.4%) babies were born alive. Prenatal detection rate was highest in double outlet right ventricle (77.3%) and hypoplastic left heart (50.6%). Detection rate increased significantly (p<0.001) for 12/17 lesions comparing 1986-1999 and 2000-2006. In recent years, detection of hypoplastic left heart reached 95.8% while transposition of the great arteries was diagnosed antenatally in only 25.6%. CONCLUSION: The nationwide prenatal ultrasound screening programme enabled detection of major cardiac abnormalities in 1/3 of patients born with any CHD and 80% of those with critical forms. Nevertheless, owing to the severity of lesions and associated extracardiac anomalies, the overall mortality of antenatally diagnosed CHD remains high. These findings are important for the understanding natural history of CHD for the establishing of screening programmes in Europe."
26,GARD:0001907,Double outlet left ventricle,19056236,"['Journal Article', 'Case Reports']",Crisscross hearts in adults: echocardiographic evaluation and natural history.,https://pubmed.ncbi.nlm.nih.gov/19056236,"Crisscross heart is a rare congenital, rotational abnormality of the ventricular mass, resulting in the crossing of the inflows of the 2 ventricles and each atrium emptying into the contralaterally located ventricle. Few cases of adult patients are described in the literature. We present a case series of 7 adult patients aged 18 to 53 years with crisscross hearts, followed up for 5 to 22 years (mean 14.4 years) at the Institute of Cardiology Warsaw. Only in 2 patients was the diagnosis of crisscross heart made at infancy. In the remaining 5 patients, the diagnosis was made at the age of 7 to 26 years. All patients had complex congenital heart defects, including double outlet right ventricle in 4 patients and discordant ventriculoarterial connections in 3 patients, with numerous associated lesions. In all patients, the diagnosis of crisscross heart was made by transthoracic echocardiographic examination. Five patients underwent surgical procedures, including Rastelli operation, arterial switch, Glenn anastomosis, and central shunt, according to the individual morphology and hemodynamics. The clinical outcome depended predominantly on the underlying hemodynamic abnormalities and the results of surgical management rather than on crisscross anatomy. Successful surgery allowed acceptable functional status in adulthood."
